{"$schema":"https://json-schema.org/draft/2020-12/schema","type":"object","additionalProperties":false,"required":["task_id","conclusion","result","claimed_assurance","scope","completeness","evidence","limitations"],"properties":{"task_id":{"const":"jacobian/primitive-eisenstein-norm-audit"},"conclusion":{"const":"SOURCE_PRIMITIVE_NORM_CRITERION_FALSE"},"result":{"$ref":"#/$defs/result"},"claimed_assurance":{"enum":["UNVERIFIED","COMPUTED"]},"scope":{"const":"PRIMITIVE_EISENSTEIN_NORM_LOCAL_CRITERION_ONLY"},"completeness":{"const":"COMPLETE"},"evidence":{"type":"array","minItems":1,"maxItems":1,"items":{"type":"object","additionalProperties":false,"required":["path","sha256"],"properties":{"path":{"const":"evidence/local-audit.json"},"sha256":{"type":"string","pattern":"^sha256:[0-9a-f]{64}$"}}}},"limitations":{"const":["CUBIC_FORM_INTERSECTION_COUNT_NOT_ASSESSED","GENERAL_CRITERION_NOT_PROOF_ASSISTANT_VERIFIED"]}},"$defs":{"pair":{"type":"object","additionalProperties":false,"required":["x","y"],"properties":{"x":{"type":"integer","minimum":0},"y":{"type":"integer","minimum":0}}},"result":{"type":"object","additionalProperties":false,"required":["ramified_witness","inert_obstruction","repaired_criterion"],"properties":{"ramified_witness":{"type":"object","additionalProperties":false,"required":["x","y","norm","gcd","v3"],"properties":{"x":{"type":"integer","minimum":-30,"maximum":30},"y":{"type":"integer","minimum":-30,"maximum":30},"norm":{"type":"integer","minimum":1},"gcd":{"const":1},"v3":{"const":1}}},"inert_obstruction":{"type":"object","additionalProperties":false,"required":["prime","zero_pairs","square_primitive_status"],"properties":{"prime":{"enum":[2,5,11,17,23]},"zero_pairs":{"type":"array","minItems":1,"uniqueItems":true,"items":{"$ref":"#/$defs/pair"}},"square_primitive_status":{"const":"IMPOSSIBLE"}}},"repaired_criterion":{"const":"THREE_EXPONENT_AT_MOST_ONE_AND_NO_PRIME_TWO_MOD_THREE"}}}}}
