{"task_id":"jacobian/primitive-eisenstein-norm-audit","conclusion":"SOURCE_PRIMITIVE_NORM_CRITERION_FALSE","result":{"ramified_witness":{"x":1,"y":4,"norm":21,"gcd":1,"v3":1},"inert_obstruction":{"prime":5,"zero_pairs":[{"x":0,"y":0}],"square_primitive_status":"IMPOSSIBLE"},"repaired_criterion":"THREE_EXPONENT_AT_MOST_ONE_AND_NO_PRIME_TWO_MOD_THREE"},"claimed_assurance":"COMPUTED","scope":"PRIMITIVE_EISENSTEIN_NORM_LOCAL_CRITERION_ONLY","completeness":"COMPLETE","evidence":[{"path":"evidence/local-audit.json","sha256":"sha256:3c74a17627011280c6a9d553bdeb7f115f6439f55febf26124cbfac41378f1de"}],"limitations":["CUBIC_FORM_INTERSECTION_COUNT_NOT_ASSESSED","GENERAL_CRITERION_NOT_PROOF_ASSISTANT_VERIFIED"]}
